{
  "created_at": "2026-07-10T00:00:00Z",
  "evidence": {
    "cost_waterfall": "cost_waterfall.json",
    "data_manifest": "data_manifest.json",
    "metrics_report": "metrics_report.json",
    "source_notes": []
  },
  "gate_results": {
    "asset_class_gates": [
      "synthetic diagnostic only"
    ],
    "failed_gates": [
      "V3 robustness and independent audit pending"
    ],
    "universal_hard_gates": [
      "package validates",
      "accounting identities hold",
      "costs explicit"
    ]
  },
  "id": "null_random_control_v1-verdict",
  "kill_reason": "Random direction has no mechanism and does not qualify for promotion.",
  "next_action": "Run V3 walk-forward, overfit diagnostics, stress, risk, and independent audit.",
  "owner": "framework_auditor",
  "review_required_by": [
    "stats_auditor",
    "execution_skeptic"
  ],
  "risks": {
    "data": [
      "generated fixture"
    ],
    "execution": [
      "configured simulation is not live execution"
    ],
    "operational": [
      "no external process"
    ],
    "statistical": [
      "diagnostic sample; multiple-testing controls pending"
    ]
  },
  "run_receipt": "run_receipt.json",
  "schema_version": 2,
  "summary": "Seeded random control completed and is retained as a killed negative control.",
  "verdict": "kill"
}
